{
  "title": "invAIriant Audit — conveyor (pre-GA hardening)",
  "date": "2026-06-19",
  "audit_type": "full-scale",
  "project": {
    "name": "conveyor",
    "type": "infra-service",
    "commit_range": "v0.7.0..a41f9cc",
    "phase": "pre-GA hardening"
  },
  "scope": "Scheduler control plane, worker runtime, tenant API, and artifact distribution at a41f9cc, against README/ARCHITECTURE/THREAT_MODEL. Out of scope: billing exporter, Terraform, web console.",
  "inputs_reviewed": [
    "repo @ a41f9cc (~41k LOC Go)",
    "diff v0.7.0..a41f9cc",
    "docs/ARCHITECTURE.md, docs/THREAT_MODEL.md, ADRs 0007-0019",
    "go test ./... @ a41f9cc",
    "semgrep default + custom ruleset",
    "incident report INC-118"
  ],
  "participants": [
    "m.orlova (system architect, gates)",
    "d.reyes (security/threat auditor)",
    "claude-agent (lens auditor: parnas, turing, von-neumann, lamport, review-bottleneck)",
    "claude-agent-2 (evidence verifier)"
  ],
  "config_ref": "examples/infra-service/invairiant.config.yml",
  "lens_scores": [
    { "pack": "security-safety", "lens": "security-threat", "score": 4.5, "verdict": "THREAT_MODEL row 'credential exposure via logs' closed on paper only; refuted by worker/recover.go:88-104 (CNV-041)", "evidence_refs": ["CNV-041"] },
    { "pack": "core", "lens": "parnas", "score": 8, "verdict": "boundaries hold; one leak in api/handlers/jobs.go:210-232 (CNV-044, S2)" },
    { "pack": "core", "lens": "mcconnell", "score": 8, "verdict": "changes localized, ADRs current; two CHANGELOG omissions (obs O-2)" },
    { "pack": "core", "lens": "turing", "score": 7, "verdict": "dispatch/retry loops bounded; scheduler-decision replay tooling missing (obs O-1)" },
    { "pack": "systems", "lens": "von-neumann", "score": 5.5, "verdict": "Redis cache treated as truth on recovery (CNV-043)" },
    { "pack": "systems", "lens": "lamport", "score": 6, "verdict": "webhook retry lacks end-to-end idempotency key (CNV-042)" }
  ],
  "findings": [
    {
      "id": "CNV-041",
      "severity": "S0",
      "lens": "security-threat",
      "category": "SECRET_LEAK",
      "claim": "The worker crash-recovery path serializes the entire job environment, including tenant-scoped API keys, into the shared operator log.",
      "evidence": [
        { "type": "file_lines", "file": "worker/recover.go", "lines": "88-104", "commit": "a41f9cc", "description": "log.Errorw(\"job crashed\", \"env\", job.Env) where job.Env carries CONVEYOR_TENANT_KEY" },
        { "type": "runtime_log", "source": "worker eu-1-w7, INC-118", "excerpt": "{\"level\":\"error\",\"msg\":\"job crashed\",\"env\":{\"CONVEYOR_TENANT_KEY\":\"ck_live_9t[REDACTED]\"}}" },
        { "type": "doc_code_contradiction", "doc": "docs/THREAT_MODEL.md:141", "code": "worker/recover.go:88-104", "description": "THREAT_MODEL marks 'credential exposure via logs' mitigated by env scrubbing that does not exist" }
      ],
      "risk": "Any operator and the log-pipeline vendor can read live tenant credentials; INC-118 already wrote 7 tenants' keys to retained logs.",
      "recommendation": "Scrub/allowlist env at the logging boundary; rotate exposed keys; add a no-secrets conformance test; fix THREAT_MODEL only after the control exists.",
      "confidence": "high",
      "status": "verified",
      "source": "hybrid",
      "affected_components": ["worker", "distrib"],
      "verification": { "verified_by": "claude-agent-2", "method": "read worker/recover.go and worker/exec.go; grepped for scrub; cross-read THREAT_MODEL:141; confirmed INC-118 excerpt", "notes": "row closed on paper only" }
    },
    {
      "id": "CNV-042",
      "severity": "S1",
      "lens": "lamport",
      "category": "REDUNDANCY_COLLAPSE",
      "claim": "Webhook delivery retries re-POST without an idempotency key, so a timeout-then-success sequence applies tenant side effects twice.",
      "evidence": [
        { "type": "file_lines", "file": "distrib/webhook.go", "lines": "71-96", "commit": "a41f9cc", "description": "retry loop re-sends the identical request; no Idempotency-Key header" },
        { "type": "missing_test", "description": "no test under distrib/ exercises timeout-after-delivery" }
      ],
      "risk": "Tenants with non-idempotent webhook actions get duplicate side effects during network degradation.",
      "recommendation": "Add a per-delivery idempotency key, document the contract, add the timeout-after-delivery test.",
      "confidence": "high",
      "status": "verified",
      "source": "ai",
      "affected_components": ["distrib"]
    }
  ],
  "observations": [
    { "text": "Scheduler decisions are not replayable: inputs logged but the decision-function version is not.", "lens": "turing" }
  ],
  "hypotheses": [
    { "text": "Dispatch loop starves low-priority tenants under saturation", "lens": "turing", "rejected_reason": "fairness property test dispatch/fairness_test.go:12-88 exists and passes at a41f9cc" },
    { "text": "semgrep: possible SSRF in artifact fetch (distrib/fetch.go:40)", "rejected_reason": "URL host pinned to tenant-registered endpoints validated at registration (api/tenants.go:118-141); scanner unaware of the invariant" }
  ],
  "summary": {
    "verdict": "fail",
    "executive_summary": "Module boundaries and construction discipline are solid for pre-GA, but the audit fails the gate on CNV-041 (tenant API keys written to the shared operator log on worker crash). Two S1s compound it: double-firing webhooks (CNV-042) and Redis-as-truth on recovery (CNV-043). A high average lens score does not offset the S0.",
    "strongest_lens": "parnas",
    "weakest_lens": "security-threat",
    "weakest_reason": "a threat-model row was closed on paper while the control did not exist (CNV-041) — exactly what this lens exists to catch",
    "required_actions": [
      { "action": "Scrub env at log boundary + rotate exposed keys + add log-schema conformance test", "finding_ids": ["CNV-041"], "owner": "d.reyes", "deadline": "2026-06-24", "blocking": true },
      { "action": "Idempotent webhook delivery + timeout-after-delivery test", "finding_ids": ["CNV-042"], "owner": "platform", "blocking": true }
    ]
  }
}
