{
  "title": "invAIriant PR audit — persistent-mesh-transport (genuine-TLS SNI derivation)",
  "date": "2026-07-03",
  "audit_type": "pr",
  "project": { "name": "persistent-mesh-transport", "type": "p2p-network" },
  "scope": "The shell renderer for an own-certificate genuine-TLS transport family (transport/render_params.sh, render_server.sh) and its tls_sni derivation. Illustrative case, synthesized from a real, fixed defect class; no project is named.",
  "inputs_reviewed": [
    "the render diff (see diff.patch)",
    "transport/render_params.sh render_params()",
    "transport/render_server.sh SNI guard"
  ],
  "participants": [
    "fable-agent (lens passes, verification, severity, synthesis)",
    "maintainer (owner, gate)"
  ],
  "config_ref": "invairiant.config.yml",
  "lens_scores": [
    { "pack": "core", "lens": "cormen", "score": 6, "verdict": "the 'own-cert SNI ≠ cover SNI' invariant is not enforced; correctness depends on an incidental wildcard SAN and the guard's fail-closed docstring is false (PMT-002)" },
    { "pack": "security-safety", "lens": "security-threat", "score": 5, "verdict": "on a no-wildcard-SAN node the own-cert family emits a cert/SNI active-probe tell + correlation channel (PMT-001)" },
    { "pack": "core", "lens": "parnas", "score": 6, "verdict": "the SNI decision is split across two shell files with a silent fallback and no typed owner (PMT-003)" },
    { "pack": "domain", "lens": "network-persistence", "score": 6, "verdict": "indistinguishability regresses for the affected node class (PMT-001)" }
  ],
  "findings": [
    {
      "id": "PMT-001",
      "severity": "S1",
      "lens": "security-threat",
      "category": "DISTINGUISHABLE_TRANSPORT",
      "claim": "The genuine-TLS SNI fallback makes an own-cert family present the node's own certificate under the cover domain's SNI on nodes without a wildcard cert — a cert/SNI active-probe tell and a cross-family correlation channel.",
      "evidence": [
        { "type": "diff_hunk", "hunk": "-[ -n \"$tls_domain\" ] || tls_domain=\"$cover\"   # fallback to the cover-domain SNI" },
        { "type": "file_lines", "file": "transport/render_params.sh", "lines": "40-52", "description": "on a self-signed cert (CN=cover domain, no wildcard SAN) the wildcard grep is empty, so tls_domain becomes $cover" },
        { "type": "doc_code_contradiction", "doc": "transport/render_params.sh (docstring: 'a misconfigured node fails closed rather than shipping a cert/SNI tell')", "code": "transport/render_server.sh:8-11", "description": "the SNI guard rejects only an EMPTY tls_sni; the non-empty cover fallback passes, so the fail-closed claim is false and the tell ships" }
      ],
      "risk": "The own-cert genuine-TLS family serves the node's own certificate under the cover domain's SNI: a cert/SNI mismatch detectable by active probing, and a channel correlating the own-cert family with the camouflaged family by shared SNI. Directly hits traffic indistinguishability and anonymity.",
      "recommendation": "Drop the cover fallback; leave tls_sni empty when no own-cert domain is derivable so the guard genuinely fail-closes; additionally reject tls_sni == cover_sni. (This is exactly the fix in diff.patch.)",
      "confidence": "high",
      "status": "verified",
      "source": "hybrid",
      "affected_components": ["transport/render_params.sh", "transport/render_server.sh"],
      "verification": { "verified_by": "fable-agent", "method": "read the fallback line and the SNI guard; traced the self-signed-cert path; confirmed the guard rejects only empty", "notes": "escalates to S0 on affected nodes; held at S1 because live nodes use a real wildcard cert (see rejected-hypotheses)" }
    },
    {
      "id": "PMT-002",
      "severity": "S2",
      "lens": "cormen",
      "claim": "The invariant that an own-cert family's SNI must never equal the cover SNI is not enforced; correctness depends on whether a wildcard SAN incidentally exists, and the guard's stated fail-closed property is false.",
      "evidence": [
        { "type": "file_lines", "file": "transport/render_server.sh", "lines": "8-11", "description": "the SNI guard is `[ -n \"$_tls_sni\" ] || die` — it rejects an empty value only, not tls_sni == cover_sni" },
        { "type": "doc_code_contradiction", "doc": "transport/render_params.sh (fail-closed docstring)", "code": "transport/render_server.sh:8-11", "description": "the documented invariant is not the one the guard checks" }
      ],
      "risk": "A security property that holds 'because of how it is called' (whether a wildcard cert happens to exist) is not a design property; the false docstring hides the gap from the next reader.",
      "recommendation": "Enforce the invariant explicitly (reject tls_sni == cover_sni for enabled own-cert families) and make the docstring describe what the guard actually checks.",
      "confidence": "high",
      "status": "verified",
      "source": "ai",
      "affected_components": ["transport/render_server.sh"]
    },
    {
      "id": "PMT-003",
      "severity": "S3",
      "lens": "parnas",
      "claim": "The SNI-derivation decision is spread across two shell files with a silent fallback and no single typed owner.",
      "evidence": [
        { "type": "file_lines", "file": "transport/render_params.sh", "lines": "33-52", "description": "derives tls_sni via cert-SAN parsing with an inline fallback" },
        { "type": "file_lines", "file": "transport/render_server.sh", "lines": "5-13", "description": "re-checks the same decision in a separate guard; the two must agree by hand" }
      ],
      "risk": "A security-critical decision with no typed contract drifts: the two sites can disagree, and there is no single owner of the SNI rule.",
      "recommendation": "Move SNI derivation and validation behind a single typed contract that both the renderer and the guard consume.",
      "confidence": "medium",
      "status": "verified",
      "source": "ai",
      "affected_components": ["transport/render_params.sh", "transport/render_server.sh"]
    }
  ],
  "hypotheses": [
    { "text": "All production nodes are exposed by this tell.", "lens": "security-threat", "rejected_reason": "Refuted — live nodes use a real wildcard cert, so the wildcard-SAN branch derives tls_sni and the cover fallback is never taken. Only nodes on a built-in self-signed cert (no wildcard SAN) are affected. This is why PMT-001 is held at S1, not S0." },
    { "text": "The SNI guard already prevents the tell (it 'fails closed').", "lens": "cormen", "rejected_reason": "Refuted — the guard rejects only an EMPTY tls_sni; the cover fallback yields a non-empty value that passes. The docstring's fail-closed claim does not match the code." }
  ],
  "summary": {
    "verdict": "pass_with_conditions",
    "executive_summary": "The renderer's genuine-TLS SNI fallback (|| tls_sni=$cover) makes the own-cert family present its own certificate under the cover domain's SNI on nodes without a wildcard cert — a cert/SNI active-probe tell and a cross-family correlation channel (PMT-001, S1). The invariant is not enforced and the guard's fail-closed docstring is false (PMT-002). A diff-level reviewer approves a documented, working fallback; the lenses do not. Live nodes with real wildcard certs are unaffected, holding PMT-001 at S1. ci-gate blocks the merge until fixed.",
    "strongest_lens": "cormen",
    "weakest_lens": "security-threat",
    "weakest_reason": "the emitted config is distinguishable under active probing on the affected node class (PMT-001)",
    "required_actions": [
      { "action": "Drop the cover fallback; leave tls_sni empty when undecidable (guard fail-closes); reject tls_sni == cover_sni.", "finding_ids": ["PMT-001", "PMT-002"], "owner": "renderer owner", "blocking": true },
      { "action": "Move SNI derivation/validation behind a single typed contract.", "finding_ids": ["PMT-003"], "owner": "renderer owner", "blocking": false }
    ]
  }
}
